title,content
"Jobs, rural India likely to be focus of new Modi government's first budget, says Goldman Sachs","MUMBAI (Reuters) - The first budget by Prime Minister Narendra Modi's new government may tilt towards, but not pivot to welfare spending, with a focus on rural economy and job creation, economists at Goldman Sachs said in a note on Monday.
The budget proposal for the financial year ending March 2025 will be presented on July 23, the government said over the weekend.
Goldman economists expect the government to stick to its fiscal deficit target of 5.1% of GDP set in the interim budget but said it will likely make an ""overarching statement"" about long-term economic policy.
""We see an emphasis on job creation through labor-intensive manufacturing, credit for micro, small and medium enterprises, continued focus on services exports by expanding global capability centres, and a thrust on domestic food supply chain,"" Santanu Sengupta, chief India economist at the Wall Street bank wrote.
Modi's Bharatiya Janata Party failed to win a majority on its own in national elections this year and returned to power with the help of allies. Post-poll surveys showed that unemployment and inflation were key concerns among voters, particularly outside of urban areas.
While the Indian economy is seen growing a fast clip of 7.2% this year, job creation has lagged.
""Even 7% GDP growth might not be able to fulfill the job requirement over the next decade,"" Citi's chief India economist Samiran Chakraborty said in a note last week, adding that growth of close to 7% will generate 8 million to 9 million jobs per year, short of the 11 million to 12 million needed.
Goldman expects the budget to push labour intensive manufacturing through fiscal incentives across sectors like toys, textiles and apparel manufacturing, along with commercial aircraft manufacturing. 
Citi, in a report, said the government could consider extending its flagship production linked incentive scheme with a focus on ""more domestic value addition and explicit employment targets.""
Almost two-third manufacturing jobs are in low-skilled labor-intensive sectors, Citi said, without specifying whether these announcements would be made in the budget.
Goldman also expects a focus on agricultural infrastructure and incentives to increase domestic production of key crops as a way to target high food inflation, which has been running close to 8% for many months. 
(This story has been refiled to correct the spelling of voters, in paragraph 5)"
Oil slips as Gaza talks ease supply disruption woes; Hurricane Beryl in focus,"By Florence Tan
SINGAPORE (Reuters) -Oil prices slid on Monday after rising for four weeks, as the prospect of a ceasefire deal in Gaza eased geopolitical tensions in the Middle East, while investors assessed potential disruption to U.S. energy supplies from Tropical Storm Beryl. 
Brent crude futures were down 36 cents, or 0.4%, at $86.18 a barrel, as at 0646 GMT.
U.S. West Texas Intermediate crude was at $82.71 a barrel, down 45 cents, or 0.5%.
Talks over a U.S. ceasefire plan aimed at ending the nine-month-old war in Gaza are under way, and being mediated by Qatar and Egypt.
""If anything concrete comes from the ceasefire talks, it will take some of geopolitical bid out of the market for now,"" said IG analyst Tony Sycamore based in Sydney.
The ports of Corpus Christi, Houston, Galveston, Freeport and Texas City closed on Sunday to prepare for Hurricane Beryl, which is expected to make a landfall in the middle of the Texas coast between Galveston and Corpus Christi later on Monday.
Port closures could bring a temporary halt to crude and liquefied natural gas exports, oil shipments to refineries, and motor fuel deliveries from those plants.
""While this puts some offshore oil and gas production at risk, the concern when the storm makes landfall is the potential impact it could have on refinery infrastructure,"" ING analysts led by Warren Patterson said in a note.
""Any meaningful disruptions to Texas refinery operations will likely support refined product cracks.""
IG's Sycamore said there is also a good chance of U.S. data showing another large weekly draw in U.S. oil inventories amid peak driving season, which will be supportive for oil prices.
WTI gained 2.1% last week after data from the Energy Information Administration showed stockpiles for crude and refined products fell in the week ended June 28. [EIA/S]
""WTI has had a very good run, though, having rallied 15% from the early June low,"" Sycamore said, adding that the benchmark could see strong resistance between $85.50 and $87.50 based on technical charts.
The number of operating oil rigs in the U.S. were unchanged at 479 last week, holding at its lowest since December 2021, Baker Hughes said in its weekly report on Friday.
Oil prices were also supported last week by hopes of interest rate cuts following U.S. data on Friday that showed inflation is easing and job growth slowing.
Lower interest rates can boost economic activity and increase crude oil demand.
Investors were also watching for any impact from elections in the UK, France and Iran last week on geopolitics and energy policies.
France faced potential political deadlock after elections on Sunday threw up a hung parliament while Iranians chose Masoud Pezeshkian as their new president, a relative moderate who beat a hard-line rival in the election."
